{
  "$schema": "http://json-schema.org/draft-07/schema#",
  "title": "TUT Master Template — Company Config Schema",
  "description": "Validation schema for company JSON configs. Used by validateConfig() in main.js at runtime.",
  "version": "1.0.0",
  "type": "object",
  "required": ["configVersion", "brand", "hero", "contact"],
  "additionalProperties": true,

  "properties": {

    "configVersion": {
      "type": "string",
      "description": "Schema version. Increment major on breaking shape changes. Used by migrateConfig().",
      "example": "1.0.0"
    },

    "generatedAt": {
      "type": "string",
      "format": "date-time",
      "description": "ISO 8601 timestamp when this config was first generated by AI or manually."
    },

    "updatedAt": {
      "type": "string",
      "format": "date-time",
      "description": "ISO 8601 timestamp when this config was last modified."
    },

    "checksum": {
      "type": "string",
      "description": "FNV-1a hash of the config JSON content. Used to detect manual edits after AI generation. Generated by the config generator, not the renderer."
    },

    "status": {
      "type": "string",
      "enum": ["draft", "published", "archived"],
      "default": "draft",
      "description": "Controls demo visibility. draft = preview banner shown. archived = offline screen shown. published = normal render."
    },

    "locale": {
      "type": "string",
      "enum": ["en-TZ", "sw-TZ"],
      "default": "en-TZ",
      "description": "UI language for WhatsApp messages, button labels, form placeholders. Does not affect company content fields."
    },

    "lockedFields": {
      "type": "array",
      "items": { "type": "string" },
      "default": [],
      "description": "Dot-notation field paths that AI regeneration must not overwrite. Example: ['hero.headline', 'services']"
    },

    "meta": {
      "type": "object",
      "description": "SEO and social sharing metadata. Injected into <head> by applyMeta().",
      "properties": {
        "seoTitle":       { "type": "string", "description": "Page <title> and og:title." },
        "seoDescription": { "type": "string", "description": "Meta description and og:description." },
        "ogImage":        { "type": "string", "description": "Absolute URL or relative path to OG/Twitter preview image. Should be 1200x630px." },
        "defaultOgImage": { "type": "string", "description": "Template-level OG image fallback used when ogImage is absent." },
        "canonicalUrl":   { "type": "string", "description": "Full canonical URL. Example: https://demo.thisuncle.co.tz/abc-contractors" },
        "favicon":        { "type": "string", "description": "Path to favicon file." }
      }
    },

    "brand": {
      "type": "object",
      "description": "Brand identity. name and accent are required.",
      "required": ["name", "accent"],
      "properties": {
        "name":       { "type": "string",  "description": "Company display name. Used in headings, footer, WhatsApp messages." },
        "tagline":    { "type": "string",  "description": "Short tagline shown in hero eyeline." },
        "subTagline": { "type": "string",  "description": "Longer descriptor shown in header/footer." },
        "logo":       { "type": "string",  "description": "Logo image path or URL. Empty string = text logo fallback." },
        "industry": {
          "type": "string",
          "enum": ["construction", "logistics", "consultancy", "healthcare", "education", "trading", "engineering", "corporate", "general"],
          "default": "general",
          "description": "Industry classification. Drives fallback hero gradient and future theme variations."
        },
        "accent":     { "type": "string", "pattern": "^#[0-9A-Fa-f]{3,8}$", "description": "Primary brand color. Used for buttons, highlights, accents." },
        "accentAlt":  { "type": "string", "pattern": "^#[0-9A-Fa-f]{3,8}$", "description": "Hover/gradient variant. Usually a lighter shade of accent." },
        "bgDark":     { "type": "string", "pattern": "^#[0-9A-Fa-f]{3,8}$", "description": "Dark section background color." },
        "textLight":  { "type": "string", "pattern": "^#[0-9A-Fa-f]{3,8}$", "description": "Text color on dark backgrounds." }
      }
    },

    "hero": {
      "type": "object",
      "description": "Hero section content. headline and subheadline are required.",
      "required": ["headline", "subheadline"],
      "properties": {
        "headline":    { "type": "string", "description": "Main headline — first line." },
        "headlineEm":  { "type": "string", "description": "Emphasized second line (italic serif)." },
        "subheadline": { "type": "string", "description": "Supporting paragraph below headline." },
        "bgImage":     { "type": "string", "description": "Hero background image path or URL. Falls back to industry gradient on error." },
        "bgVideo":     { "type": "string", "description": "Hero background video path. Takes priority over bgImage if set." },
        "ctaPrimary": {
          "type": "object",
          "description": "Primary CTA button.",
          "properties": {
            "label": { "type": "string" },
            "type":  { "type": "string", "enum": ["whatsapp", "link"] },
            "href":  { "type": "string" }
          }
        },
        "ctaSecondary": {
          "type": "object",
          "description": "Secondary CTA button (ghost style).",
          "properties": {
            "label": { "type": "string" },
            "href":  { "type": "string" }
          }
        },
        "badges": {
          "type": "array",
          "description": "Stat badges shown at the bottom of the hero.",
          "items": {
            "type": "object",
            "properties": {
              "value": { "type": "string" },
              "label": { "type": "string" }
            }
          }
        }
      }
    },

    "about": {
      "type": "object",
      "description": "About section content.",
      "properties": {
        "heading": { "type": "string", "description": "Section heading. Use \\n for a line break." },
        "body": {
          "description": "Body paragraphs. Can be a single string or array of strings.",
          "oneOf": [
            { "type": "string" },
            { "type": "array", "items": { "type": "string" } }
          ]
        },
        "image": { "type": "string", "description": "About section image path or URL." },
        "director": {
          "description": "Director/founder quote card. Set to null to hide.",
          "oneOf": [
            { "type": "null" },
            {
              "type": "object",
              "properties": {
                "name":  { "type": "string" },
                "title": { "type": "string" },
                "photo": { "type": "string" },
                "quote": { "type": "string" }
              }
            }
          ]
        }
      }
    },

    "services":     { "$ref": "#/definitions/visibleSection", "description": "Services section." },
    "projects":     { "$ref": "#/definitions/visibleSection", "description": "Projects/tender highlights section." },
    "stats":        { "$ref": "#/definitions/visibleSection", "description": "Animated stats counter section." },
    "whyUs":        { "$ref": "#/definitions/visibleSection", "description": "Why choose us section." },
    "gallery":      { "$ref": "#/definitions/visibleSection", "description": "Image gallery section." },
    "testimonials": { "$ref": "#/definitions/visibleSection", "description": "Client testimonials carousel." },

    "contact": {
      "type": "object",
      "description": "Contact information. whatsapp is required — all WhatsApp CTAs derive from it.",
      "required": ["whatsapp"],
      "properties": {
        "phone":    { "type": "string", "description": "Display phone number including country code." },
        "whatsapp": { "type": "string", "pattern": "^[0-9]{10,15}$", "description": "WhatsApp number — digits only, no +, no spaces. Tanzania: 255XXXXXXXXX" },
        "email":    { "type": "string", "description": "Contact email address." },
        "address":  { "type": "string", "description": "Physical address." },
        "mapEmbed": { "type": "string", "description": "Google Maps embed src URL only (not the full iframe tag)." }
      }
    },

    "social": {
      "type": "object",
      "description": "Social media profile URLs. Empty string = hidden.",
      "properties": {
        "facebook":  { "type": "string" },
        "instagram": { "type": "string" },
        "linkedin":  { "type": "string" },
        "twitter":   { "type": "string" },
        "youtube":   { "type": "string" }
      }
    },

    "cta": {
      "type": "object",
      "description": "CTA banner section.",
      "properties": {
        "heading":     { "type": "string" },
        "subheading":  { "type": "string" },
        "buttonLabel": { "type": "string" }
      }
    },

    "internal": {
      "type": "object",
      "description": "CRM and operational metadata. NEVER rendered publicly. Used by dashboard and generation pipeline.",
      "properties": {
        "leadId":        { "type": "string",  "description": "Unique lead ID from the CRM system." },
        "createdAt":     { "type": "string",  "format": "date-time", "description": "When the lead was first identified." },
        "updatedAt":     { "type": "string",  "format": "date-time", "description": "When the lead record was last updated." },
        "generatedBy":   { "type": "string",  "description": "Which system/agent generated this config." },
        "source":        { "type": "string",  "description": "Lead source. Example: nest-awarded-tenders, manual, referral." },
        "salesRep":      { "type": "string",  "description": "Username of the sales rep who owns this lead." },
        "demoVersion":   { "type": "string",  "description": "Template version used when this demo was generated." },
        "outreachStatus": {
          "type": "string",
          "enum": ["pending", "sent", "responded", "converted", "closed"],
          "description": "Current state of the outreach process for this lead."
        },
        "_dataSourceHint": {
          "type": "object",
          "description": "Future: per-field source/confidence metadata for AI-enriched data. Shape: { fieldPath: { value, source, confidence } }",
          "additionalProperties": true
        }
      }
    }

  },

  "definitions": {
    "visibleSection": {
      "type": "object",
      "description": "Reusable shape for all optional array sections.",
      "required": ["visible", "items"],
      "properties": {
        "visible": {
          "type": "boolean",
          "description": "If false, the section is hidden regardless of items content."
        },
        "items": {
          "type": "array",
          "description": "Section content. Empty array auto-hides the section even if visible is true."
        }
      }
    }
  }
}
